,ArticleText,PublishDate,CleanedArticleText
54,"Our live coverage of the coronavirus pandemic has moved here.
Former Vice President got visibly emotional Friday night when discussing how hard it is to not be there for loved ones dying from coronavirus.
Biden referenced his personal history of losing his wife, children and parents.
He continued: ""And seek help.
Seek help afterwards.
Seek help, talk to people who have been through it so they know, they know they can tell you that you can get through it.
That's one of the cruelest, cruelest things that's happening."" Biden closed out the town hall by encouraging anyone struggling with loss to contact his campaign.
Federal health officials on Friday green-lit a point-of-care coronavirus test that can provide results in less than 15 minutes, using the same technology that powers some rapid flu tests.
Teased by Vice President Mike Pence in a Thursday press briefing, the new diagnostic could accelerate testing in the United States, allowing for rapid results in doctors’ offices.
But shortages of critical equipment used to collect patient specimens, such as masks and swabs, could blunt its impact.
The US Food and Drug Administration authorized the test for emergency use, signaling that federal regulators were satisfied with the test’s validation data and believe its benefits outweigh any risks, such as false positives or negatives.
The test’s maker, Abbott, said it expects to deliver 50,000 tests per day beginning next week.
The platform used to run the test weighs less than 7 pounds, according to Abbott, and could be deployed “where testing is needed most,” such as at coronavirus hotspots.
More on this: Last week, the FDA authorized another rapid test – one from molecular diagnostics company Cepheid, which provides results in about 45 minutes.
Most laboratory tests for the coronavirus take anywhere from a few hours to days to receive results.
All FDA-authorized tests, however, require samples from patients – and health care facilities say they’re facing shortages of critical supplies needed to collect specimens.
The US Centers for Disease Control and Prevention on Tuesday issued guidance allowing some patients to collect their own nasal swabs in health care facilities, which could reduce the amount of protective equipment needed for health care workers.
But some jurisdictions, such as New York City, have said that patients with coronavirus-like illness should stay home – saying that is “safer for the patients and health care workers” and doesn’t change the treatment patients receive.
Joe Biden said he would freeze rent for the next three months and forgive the payments missed amid the coronavirus pandemic.
“Freeze it and forgive it so that you’re able to stay in that place,” the former vice president said in a CNN town hall Friday night.
Biden implied there could be conditions -- noting that enhanced unemployment insurance replacing lost income up to $75,000 per year and $1,200 cash payments approved by Congress this week could replace the income of some people who have lost their jobs, and “then in fact that would take care of it.” Then, Biden added: “There should be a rent freeze.
No one should be evicted during this period -- period.” Today in California, Gov. Gavin Newsom ordered a freeze on eviction enforcement and legal proceedings related to coronavirus through May 31.
Joe Biden praised the $2 trillion stimulus package signed by President Donald Trump today, but worried that the largest emergency aid package in US history might not be enough to save the small businesses ravaged by the crisis.
Biden said the provision in the bill that blocks executives from buying back stock was a good step in assuring that those who need the help get it, but pushed for additional government action if banks don’t start pumping out capital.
They are in a position where we're going to say to the banks you got to get them out the door.
As you know, they're not very good at getting out the door the small business loans,” Biden said.
The former vice president also suggested that, should banks fail to recapitalize those businesses, the White House should consider finding some executive authority – “another version of the Defense Production Act” -- as a way, he said, to “keep the economy in better shape than anything else we're doing.” Joe Biden has run for president essentially promising to be the nation’s healer-in-chief.
He argued during CNN’s coronavirus town hall that America is showing a spirit of togetherness that he hopes will extend well beyond the crisis.
Biden offered an example of a kindergarten teacher in North Carolina who drove from home to home of her students, beeping her horn so they would come out and wave from the driveway for a moment.
He said it took her several hours to get through the neighborhood, but she’s continuing to do it.
Biden, who advanced an initiative to try to beat cancer, said his wife Jill is helping to put together a network to offer support for patients who are dealing with their cancer diagnoses and get through chemotherapy.
“I am so proud, and it sounds corny, but I am proud to be an American,” Biden said.
Joe Biden said Friday that he believes there is “no distinction” between the physical and mental health problems that stem from coronavirus, acknowledging the increasing rates of anxiety and depression as the country uses social isolation to combat the spreading virus.
Biden said he has heard not only about the anxiety that comes from being forced to stay home for long stretches of time, but also the “fear of going into the operating room or the physical fear of pulling someone out of a burning car that, in fact, may also have had the virus.” The comment stemmed from a question clinical psychologist and professor from Chicago, who asked the former vice president about the mental health impact of being socially isolated as the country fights coronavirus.
Biden also said, as president, he would force insurance companies to cover physical and mental health equally and “open a significant number of mental health clinics” in rural America.
“In most rural areas, there's still the same problems as every other area but they don't have these clinics available to them,” Biden said, “so I double the number of mental health clinics that exist.” And, lastly, Biden said he would increase spending on early childhood education because teachers and social workers can “pick up the early signs of distress among students.” There are at least 101,242 cases of the novel coronavirus in the United States, according to CNN Health’s tally of US cases that are detected and tested in the United States through US public health systems.
At least 1,588 people have died in the US from coronavirus.
Today there have been at least 402 new deaths reported.
That is the most deaths reported in the US in a single day.
The previous single day high of deaths reported in the US came yesterday.
There were 253 deaths reported yesterday.
Joe Biden said the House and Senate should expand on the stimulus deal Congress approved this week to cover all Americans’ coronavirus-related health care expenses.
“Anything related to the cost of the coronavirus health care should be free, paid for out of the federal funds,” Biden said in a CNN town hall Friday night.
His comment came as he addressed questions about health expenses amid the pandemic.
Biden called on President Donald Trump and Republican state attorneys general to drop their lawsuit challenging Obamacare, through which millions of Americans have health insurance.
He also said he has proposed a plan that would provide coverage through a “public option” to anyone who loses their jobs as a result of a struggling economy.
“But in the meantime, with regard to this virus, you should not have to pay anything for the cost of the virus,” Biden said.",2020-03-26,"['night', 'love', 'reference', 'history', 'wife', 'child', 'parent', 'help', 'help', 'help', 'talk', 'people', 'thing', 'town', 'loss', 'contact', 'campaign', 'health', 'point', 'care', 'test', 'result', 'minute', 'use', 'technology', 'power', 'flu', 'test', 'press', 'briefing', 'testing', 'states', 'result', 'doctor', 'office', 'shortage', 'equipment', 'use', 'impact', 'food', 'drug', 'administration', 'test', 'emergency', 'use', 'regulator', 'test', 'validation', 'benefit', 'risk', 'test', 'maker', 'test', 'day', 'week', 'platform', 'use', 'test', 'pound', 'testing', 'week', 'test', 'company', 'cepheid', 'result', 'minute', 'test', 'hour', 'day', 'result', 'test', 'health', 'care', 'facility', 'face', 'shortage', 'supply', 'centers', 'issue', 'guidance', 'health', 'care', 'facility', 'amount', 'equipment', 'health', 'care', 'worker', 'jurisdiction', 'city', 'home', 'health', 'care', 'worker', 'change', 'treatment', 'rent', 'month', 'payment', 'place', 'town', 'night', 'condition', 'unemployment', 'insurance', 'income', 'year', 'cash', 'payment', 'week', 'income', 'people', 'job', 'fact', 'care', 'rent', 'period', 'period', 'today', 'order', 'eviction', 'enforcement', 'praise', 'package', 'sign', 'today', 'emergency', 'aid', 'package', 'history', 'business', 'ravage', 'crisis', 'provision', 'stock', 'step', 'help', 'push', 'government', 'action', 'bank', 'pump', 'capital', 'position', 'bank', 'door', 'door', 'business', 'loan', 'bank', 'business', 'version', 'defense', 'production', 'way', 'economy', 'shape', 'promise', 'nation', 'town', 'crisis', 'offer', 'example', 'kindergarten', 'teacher', 'home', 'home', 'student', 'beep', 'horn', 'driveway', 'moment', 'hour', 'neighborhood', 'cancer', 'wife', 'help', 'network', 'offer', 'support', 'deal', 'cancer', 'diagnosis', 'distinction', 'health', 'problem', 'increase', 'rate', 'anxiety', 'depression', 'country', 'use', 'isolation', 'combat', 'virus', 'anxiety', 'force', 'home', 'stretch', 'time', 'fear', 'room', 'fear', 'car', 'fact', 'virus', 'comment', 'question', 'psychologist', 'health', 'impact', 'country', 'force', 'insurance', 'company', 'cover', 'health', 'number', 'health', 'area', 'problem', 'area', 'number', 'health', 'increase', 'spending', 'childhood', 'education', 'teacher', 'worker', 'sign', 'distress', 'student', 'case', 'states', 'health', 'case', 'test', 'states', 'health', 'system', 'people', 'today', 'death', 'report', 'death', 'report', 'day', 'day', 'death', 'report', 'yesterday', 'death', 'report', 'yesterday', 'deal', 'week', 'cover', 'health', 'care', 'expense', 'cost', 'health', 'care', 'town', 'night', 'comment', 'address', 'question', 'health', 'expense', 'call', 'state', 'attorney', 'challenge', 'health', 'insurance', 'plan', 'option', 'job', 'result', 'economy', 'regard', 'virus', 'cost', 'virus']"
55,"Our live coverage of the coronavirus pandemic has moved here.
The Zaandam cruise ship has been given permission to cross the Panama Canal and will then head toward Florida, according to a press release issued by the Panama Canal Saturday.
The green light comes a day after the Panama Canal said on Twitter the Zaandam would not be able to use the canal to get to Florida because the ship had passengers on board who tested positive for coronavirus.
Four ""older"" guests have died on the Zaandam and two others have tested positive for coronavirus.
The cause and manner of death for the individuals who have died has not been determined yet.
More than 130 others have displayed flu-like symptoms, according to the cruise line.
Panama’s Ministry of Health approved the passage of the Zaandam for “humanitarian reasons,” the release said.
No passengers or crew members will be allowed to disembark on Panamanian territory, the statement said.
The ship was scheduled to cross the Panama Canal on April 1, but passage could happen earlier, according to the Panama Canal.
There are a total of 1,243 guests and 586 crew on board the Zaandam.
The ship departed Buenos Aires, Argentina, on March 7 and was scheduled to sail to Chile, but has been denied access to ports.
At least 696 members of the New York Police Department have tested positive for coronavirus, according to a daily coronavirus report from the NYPD.
There are 608 uniformed members and 88 civilian members who have tested positive.
About 12% of the department's uniformed workforce -- or 4,342 employees -- were out sick on Saturday, the report said.
President Donald Trump said in a tweet that after consulting with the governors of New York, New Jersey and Connecticut, he is asking the CDC to issue ""a strong Travel Advisory"" to be administered by those governors, in consultation with the federal government.
Trump said a ""quarantine will not be necessary."" This comes after he said earlier Saturday that he's considering mandatory short-term (two-week) quarantine on New York, certain parts of New Jersey and Connecticut.
Trump's suggestion of a mandatory quarantine was strongly opposed by New York Gov. Andrew Cuomo, who questioned whether it would be legal.
More than 2,000 people have died from the coronavirus in the United States as of 7:45 p.m. EST Saturday, according to a CNN count compiled through data on state health department websites.
There are 2,010 deaths reported as of Saturday.
There are at least 117,688 cases of coronavirus in the US as of Saturday, according to CNN Health's tally of cases that are detected and tested through US public health systems.
For the most up-to-date U.S. numbers compiled by CNN, please check this map which automatically refreshes every 10 minutes: https://www.cnn.com/interactive/2020/health/coronavirus-us-maps-and-cases/ Twitch, the video streaming platform for gamers, says it has raised more than $2.2 million so far for the World Health Organization’s Covid-19 Solidarity Response Fund.
Twitch is hosting a livestreamed concert to raise the money.
Musicians, athletes, gamers and celebrities performed live from their homes for the 12-hour Twitch charity event.
Sting, Shaggy and Diplo are slated to close the live event at 11:30 p.m. ET, according to Twitch's website.
A nurse at a downtown New Orleans hospital has described to CNN the very difficult conditions at the facility.
The nurse, who did not want to be identified out of fear that speaking to the media could lead to employment repercussions, described the situation at the hospital after finishing a shift two days ago.
The nurse told CNN that while the situation at the hospital is dire, the staff are in better shape than some.
We only have 16 unused ventilators left in hospital.
We’ve been told the surrounding hospitals are at max capacity without ventilators, leaving our hospital and one other major hospitals left to care for these patients,"" the nurse said.
""EMS are having to recruit volunteer EMT workers to help as New Orleans EMS paramedics are either in quarantine for exposure or sick themselves."" A physician assistant working in the emergency room of a hospital in the New York borough of Queens described an ""every man for themselves"" atmosphere surrounding personal protective equipment (PPE).
CNN is not naming this health care worker because they feared repercussions at the hospital for speaking to the media.
This physician assistant told CNN staff were informed two days ago that they would have to make their N95 mask last for five days and that they have been given tips by management about how to keep them clean.
PPE is being prioritized for those staff working with intubated patients, who are the most at risk of infection, the physician's assistant said.
Intubation is when a tube is inserted through the mouth and into the patient's airway, so the patient can be placed on a ventilator to assist with breathing.
The physician assistant hasn't heard when the hospital will receive more supplies.
The physician assistant described a crowded ER that is essentially doubling as an intensive care unit due to the large numbers of people who need to be intubated due to Covid-19.
“There’s patients everywhere,"" the physician assistant said.
""I think that no one ever expected to need this many supplies in a short period of time,"" the worker said.
The ER worker emphasized that they felt the hospital administration and management's support of staff has been ""pretty impressive"" and that they have been checking in on the ER staff's needs, even helping staff members find hotel rooms so that they do not need to go home and possibly sicken their families.
The physician assistant wanted to emphasize to the public the importance of social distancing to help stop the spread of the virus.
""You need to stay home, you need to stay away from people” they told CNN.
New York Gov. Andrew Cuomo told CNN he would sue Rhode Island if they did not roll back a policy of stopping all cars with New York license plates, but that he expects the two states will be able to work it out amicably.
""That clearly is unconstitutional,"" Cuomo said, adding he understands Rhode Island's goal of trying to slow the spread of coronavirus.
""But there's a point of absurdity, and I think what Rhode Island did is at the point of absurdity.
Again, it is not even legal,"" he said.
No state should be using police to prohibit interstate travel in any way, Cuomo said.",2020-03-27,"['cruise', 'ship', 'permission', 'head', 'press', 'release', 'issue', 'light', 'day', 'use', 'ship', 'passenger', 'board', 'test', 'test', 'manner', 'death', 'display', 'flu', 'symptom', 'cruise', 'line', 'health', 'passage', 'reason', 'release', 'passenger', 'crew', 'member', 'territory', 'statement', 'ship', 'schedule', 'passage', 'crew', 'board', 'ship', 'aires', 'schedule', 'access', 'port', 'member', 'police', 'test', 'report', 'member', 'member', 'test', 'employee', 'report', 'issue', 'travel', 'consultation', 'government', 'term', 'week', 'part', 'suggestion', 'question', 'people', 'states', 'state', 'health', 'website', 'death', 'report', 'case', 'health', 'case', 'test', 'health', 'system', 'date', 'number', 'minute', 'https://www.cnn.com/interactive/2020/health/coronavirus-us-maps-and-cases/', 'streaming', 'platform', 'world', 'health', 'response', 'host', 'money', 'athlete', 'celebrity', 'home', 'charity', 'event', 'event', 'website', 'downtown', 'hospital', 'condition', 'facility', 'fear', 'employment', 'repercussion', 'situation', 'hospital', 'finish', 'shift', 'day', 'situation', 'hospital', 'staff', 'shape', 'ventilator', 'hospital', 'hospital', 'capacity', 'ventilator', 'hospital', 'hospital', 'care', 'worker', 'help', 'exposure', 'assistant', 'work', 'emergency', 'room', 'hospital', 'man', 'atmosphere', 'equipment', 'name', 'health', 'care', 'worker', 'fear', 'repercussion', 'hospital', 'assistant', 'staff', 'day', 'day', 'management', 'staff', 'work', 'risk', 'infection', 'assistant', 'intubation', 'tube', 'place', 'ventilator', 'assistant', 'hospital', 'supply', 'assistant', 'care', 'unit', 'number', 'people', 'assistant', 'supply', 'period', 'time', 'worker', 'worker', 'hospital', 'administration', 'management', 'support', 'staff', 'staff', 'help', 'staff', 'member', 'hotel', 'room', 'home', 'family', 'assistant', 'importance', 'help', 'virus', 'home', 'people', 'policy', 'car', 'license', 'plate', 'state', 'work', 'goal', 'point', 'absurdity', 'point', 'absurdity', 'state', 'use', 'police', 'travel', 'way']"
