,ArticleText,PublishDate,CleanedArticleText
36,"Our live coverage of the novel coronavirus has moved here.
Republican Rep. Mark Meadows, President Trump's new chief of staff, is in self-quarantine as a protective measure, his office said.
""Rep. Meadows was advised this weekend that he may have come in contact with the (Conservative Political Action Conference) attendee who tested positive for COVID-19, now 12 days ago,"" said Ben Williamson, Meadow's chief of staff.
Meadows was not scheduled to start his new job this week, an official said.
Some background: Georgia Rep. Doug Collins, the top Republican on the House Judiciary Committee, Rep. Matt Gaetz of Florida, Sen. Ted Cruz of Texas and Rep. Paul Gosar of Arizona announced that they would self-quarantine after coming into contact with an individual who has been diagnosed with the novel coronavirus at the recent CPAC.
Rep. Louie Gohmert of Texas was told by officials over the weekend that he had also been in proximity to the individual, but he is not planning to self-quarantine, a Gohmert aide tells CNN, details the congressman himself confirmed on Twitter on Monday evening.
Japan's Health Ministry have announced an additional 26 cases of novel coronavirus.
The additional cases bring the country's total to 1,210 confirmed cases.
Vietnam confirmed one new case of novel coronavirus, bringing the nationwide tally to 31, according to a government statement.
The new case is a 49-year old British national who was on the same Vietnam Airlines' flight with a previously confirmed patient who flew from the United Kingdom to Vietnam on March 2.
He is the eighth British national and the 10th foreign patient confirmed in Vietnam who was on board that flight.
Of the 31 patients confirmed in Vietnam so far, 16 had been discharged.
The United Kingdom has advised its citizens on Monday “against all but essential travel to Italy, due to an ongoing outbreak of coronavirus,” according to a statement from Britain's Foreign and Commonwealth Office (FCO).
The advisory came after Italy's Prime Minister Giuseppe Conte announced at a news conference on Monday that the whole country of Italy is now on lockdown.
“British nationals remain able to depart Italy without restriction,” the FCO said.
However, airline schedules are subject to change and some flights are being cancelled,” the FCO added.
People infected by novel coronavirus tend to develop symptoms about five days after exposure, and almost always within two weeks, according to a study released Monday in the journal Annals of Internal Medicine.
That incubation period is consistent with previous estimates from public health officials, and the findings suggest that 14 days of quarantine are appropriate for people potentially exposed to the coronavirus.
The US Centers for Disease Control and Prevention has used that standard during the current pandemic — recommending, for example, that people self-quarantine for two weeks after traveling to countries with widespread coronavirus transmission, such as Italy or South Korea.
To estimate the incubation period, researchers scoured more than 180 reports of coronavirus in places without widespread transmission of the virus — areas, in other words, where infection was likely due to outside travel.
Because the study was conducted early in the coronavirus epidemic, community transmission at the time was limited to Wuhan, China.
That allowed researchers to estimate the “time of exposure” to the coronavirus by determining when a person was in Wuhan — the only plausible source of infection.
By comparing travel to Wuhan with the emergence of symptoms, researchers could then estimate an incubation period for the virus: usually about five days, and rarely more than 12.
It’s possible, the researchers said, that their study may have focused on more severe cases of the virus – which are likelier to make the news and catch the attention of public health officials.
The incubation for mild cases, then, might differ somewhat.
Of the 80,000 confirmed coronavirus cases reported in China, ""more than 70% have recovered and been discharged,"" according to the World Health Organization (WHO) in a news conference on Monday.
WHO Director-General Tedros Adhanom Ghebreyesus addressed the outbreak in his opening remarks, saying it's important to remember ""of all the cases reported globally so far, 93% are from just four countries."" The director-general emphasized that the situation can still be controlled.
""The bottom line is,"" Tedros said, ""we are not at the mercy of this virus."" Treasury Secretary Steven Mnuchin said oil market changes were a large component in the day’s earlier stock market decline.
So we saw an overnight reaction of over down 20% and that’s obviously what had a major component today on the stock market,” Mnuchin said Monday at a White House press briefing.
Mnuchin also said the US is moving into the economic bumpiness from a good place.
“We couldn’t be more pleased that coming into the situation with the coronavirus the US has the most resilient economy in the world.
We are committed and we just had a meeting with the President and the economic team,” he said.
Mnuchin described what new economic initiatives the President will propose tomorrow.
This is about providing proper tools and liquidity to get through the next few months,” Mnuchin added.
The Trump administration will soon release guidance on how to keep workplaces, schools, homes and commercial businesses safe from novel coronavirus, Dr. Deborah Birx, coronavirus task force coordinator, said Monday.
She told reporters at a White House press briefing that the guidance will be provided later Monday.
Vice President Mike Pence said the guidance would be posted Monday night on Coronavirus.gov.
Pence went on to say that the administration is ""working very diligently to establish a single website where people can go to track all of the cases and where they are emerging.” Please enable JavaScript for a better experience.",2020-03-08,"['meadows', 'staff', 'self', 'measure', 'office', 'meadows', 'weekend', 'contact', 'action', 'conference', 'attendee', 'test', 'day', 'staff', 'meadows', 'schedule', 'job', 'week', 'background', 'self', 'contact', 'weekend', 'proximity', 'plan', 'self', 'aide', 'detail', 'evening', 'health', 'case', 'case', 'country', 'case', 'case', 'government', 'statement', 'case', 'airlines', 'flight', 'board', 'flight', 'citizen', 'travel', 'statement', 'office', 'news', 'conference', 'country', 'lockdown', 'restriction', 'schedule', 'change', 'flight', 'people', 'symptom', 'day', 'exposure', 'week', 'study', 'release', 'medicine', 'incubation', 'period', 'estimate', 'health', 'day', 'people', 'centers', 'use', 'example', 'people', 'self', 'week', 'travel', 'country', 'transmission', 'estimate', 'incubation', 'period', 'researcher', 'scour', 'report', 'place', 'transmission', 'virus', 'area', 'word', 'infection', 'travel', 'study', 'conduct', 'epidemic', 'community', 'transmission', 'time', 'researcher', 'estimate', 'time', 'exposure', 'person', 'source', 'infection', 'travel', 'emergence', 'symptom', 'researcher', 'estimate', 'incubation', 'period', 'virus', 'day', 'researcher', 'study', 'case', 'virus', 'news', 'attention', 'health', 'incubation', 'case', 'case', 'report', 'world', 'health', 'news', 'conference', 'director', 'address', 'opening', 'case', 'report', 'country', 'director', 'situation', 'bottom', 'line', 'mercy', 'virus', 'oil', 'market', 'change', 'component', 'day', 'stock', 'market', 'decline', 'reaction', 'component', 'today', 'stock', 'market', 'press', 'briefing', 'place', 'situation', 'economy', 'world', 'meeting', 'team', 'tomorrow', 'liquidity', 'month', 'administration', 'release', 'guidance', 'school', 'home', 'business', 'task', 'force', 'coordinator', 'reporter', 'press', 'guidance', 'guidance', 'night', 'administration', 'work', 'website', 'people', 'track', 'case', 'experience']"
37,"Our live coverage of the novel coronavirus has moved here.
Panama has reported its first coronavirus death, according to a statement from the Health Ministry.
The Big East Conference has announced that their plans to conduct the Big East Tournament at Madison Square Garden will proceed as scheduled this week.
The Big East says that the New York City Department of Health and the New York City Office of Emergency Management are not recommending cancellation of large gatherings in New York City at this time, but that the Big East will remain in contact with those agencies.
An Italian woman has been unable to leave her apartment where her husband’s dead body is being kept due to quarantine restrictions, Giancarlo Canepa, mayor of Borghetto Santo Spirito, told CNN Tuesday.
The husband, who had tested positive for coronavirus previously, died Monday at 2 a.m. local time.
“Yes, it is true she is still there with the body and we won’t be able to remove it until Wednesday morning,“ the mayor said.
Canepa said quarantine protocol states that no one is allowed to approach the body.
“Unfortunately, we have a security protocol we must follow,” he said.
The mayor also said that the man refused to be taken to the local hospital for recovery, which led to this situation.
“Otherwise, this wouldn’t have happened,” he said.
The story made headlines in Italy as stories emerged of the wife’s despair at remaining locked up with her husband’s dead body for hours on end.
Local television station IVG.IT posted video interviews with the woman’s neighbors who had just found out that their neighbor had passed away.
“Right now the most important thing is to think about this lady, alone with the body of her husband… No one can come close to help her nor comfort her.
Our thoughts are with her and on what she is living through,” the neighbor said on video and whose name was not made public.
Schools in the University of California (UC) system are canceling in-person classes and transitioning to online classes due to coronavirus, according to the universities’ websites.
The University of California Los Angeles (UCLA) will suspend in-person classes and transition to online platforms through April 10, the end of the second week of spring quarter.
Final exams will be offered remotely, and nonessential gatherings of more than 100 people will be canceled, the university announced.
UCLA’s university housing will remain open through spring break for those who need it.
Final exams for winter quarter at the University of California Riverside will not be held in-person.
Classes for spring quarter will be online through April 3, the university said.
Instructors should prepare to continue online instruction through the remainder of the quarter as needed, UCR added.
The University of California Santa Barbara is transitioning to remote instruction for the remainder of winter quarter and the start of spring quarter through at least the end of April, the university said.
They are also recommending students traveling for spring break to be prepared for possibly remaining away from campus through the month of April.
The University of California Davis is also canceling in-person final exams next week and is urging all events with more than 150 people to be canceled or postponed.
While UC Davis has not officially canceled in-person classes this week, they strongly encouraged faculty to go online.
CNN has previously reported changes made at UC Santa Cruz, UC Berkeley, and UC San Diego.
Portugal is suspending all flights to Italy for a period of 14 days, ANAC, Portugal’s Civil Aviation Regulator, said in a statement on Tuesday.
The order will become effective on March 11, ANAC said.
Chile announced a new measure to quarantine people entering the country from Spain and Italy, according to Health Minister Jaime Mañalich.
During a news conference in Santiago Tuesday, Mañalich said people coming to Chile from Spain and Italy would be required to complete a 14-day period of isolation from their home.
The health minister also confirmed that medical care will be provided to those in need during the isolation period.
The Coachella and Stagecoach music festivals have been postponed until October due to the threat of novel coronavirus, concert prompter Goldenvoice announced Tuesday evening.
The Coachella Valley Music and Arts Festival will now take place on October 9, 10, 11 and October 16, 17 and 18.
Stagecoach will take place on October 23, 24 and 25.
Goldenvoice said all purchases for the April dates will be honored for the rescheduled October dates and purchasers will be notified by Friday on how to obtain a refund if they are unable to attend.
Nadine Dorries, the UK's junior health minister, has tested positive for coronavirus, UK Department of Health told CNN on Tuesday.
Dorries, who is an MP and health minister for patient safety and suicide prevention, is now in self-isolation and ""the usual contract tracing has begun,"" a spokesperson for the health ministry told CNN.
UK health minister Matt Hancock tweeted about Dorries, saying: ""Really sorry to hear Nadine has tested positive for coronavirus.
She has done the right thing by self isolating at home, and both NHS and PHE staff have been brilliant.",2020-03-09,"['report', 'death', 'statement', 'health', 'conference', 'plan', 'conduct', 'tournament', 'garden', 'schedule', 'week', 'city', 'health', 'city', 'office', 'emergency', 'management', 'cancellation', 'gathering', 'city', 'time', 'contact', 'woman', 'apartment', 'husband', 'body', 'restriction', 'husband', 'test', 'time', 'body', 'morning', 'state', 'body', 'security', 'man', 'hospital', 'recovery', 'situation', 'story', 'story', 'wife', 'despair', 'husband', 'body', 'hour', 'end', 'television', 'station', 'woman', 'neighbor', 'neighbor', 'thing', 'body', 'husband', 'help', 'thought', 'neighbor', 'name', 'school', 'university', 'system', 'person', 'class', 'transition', 'class', 'university', 'website', 'university', 'person', 'class', 'transition', 'platform', 'end', 'week', 'spring', 'quarter', 'exam', 'offer', 'gathering', 'people', 'university', 'university', 'housing', 'spring', 'exam', 'winter', 'quarter', 'university', 'person', 'class', 'spring', 'quarter', 'university', 'instructor', 'instruction', 'quarter', 'university', 'transition', 'instruction', 'winter', 'quarter', 'spring', 'quarter', 'end', 'university', 'student', 'travel', 'spring', 'campus', 'month', 'university', 'person', 'exam', 'week', 'event', 'people', 'person', 'class', 'week', 'faculty', 'report', 'change', 'flight', 'period', 'day', 'aviation', 'regulator', 'statement', 'order', 'measure', 'people', 'country', 'health', 'news', 'conference', 'people', 'period', 'isolation', 'home', 'health', 'care', 'isolation', 'period', 'music', 'threat', 'prompter', 'evening', 'music', 'arts', 'place', 'place', 'purchase', 'date', 'date', 'refund', 'dorries', 'health', 'test', 'health', 'dorries', 'health', 'safety', 'suicide', 'self', 'isolation', 'contract', 'health', 'health', 'test', 'thing', 'self', 'home', 'staff']"
38,"There are at least 1,267 cases of the coronavirus in the United States, according to state and local health agencies and the US Centers for Disease Control and Prevention.
70 cases are repatriated from overseas, like citizens evacuated from China or the Diamond Princess cruise ship in Japan.
1,197 cases were detected and confirmed on US soil, spread out across 43 states and Washington, DC.
These figures include presumptive positive cases -- meaning the patient tested positive in a public health lab and is pending confirmation from the CDC.
The US death toll is now at 38, after another patient died in Washington state.
Europe appears to have been largely blindsided by President Trump’s announcement earlier today that the US was suspending travel from 26 European countries.
Several European ambassadors in Washington tell CNN they didn’t know this was coming, despite having been in contact with the administration over the past few days.
One ambassador in DC said there was “no indication” Trump would go to the lengths he did, while another spokesperson said German officials had no advanced warning this was coming.
The Trump administration notified ambassadors after the announcement: Several European ambassadors expressed a need for clarity as they worked to digest what these new measures mean.
They had received calls from the State Department after the announcement -- but they ""have not yet answers to our questions,” said one ambassador.
State Department officials say they didn’t know precisely what Trump was going to roll out, given the fact that multiple options were on the table.
Secretary of State Mike Pompeo met with the Australian Foreign Minister less than five hours before Trump’s address -- and gave no indication of the announcement coming tonight, according to a source familiar with the meeting.
The US State Department raised the worldwide travel advisory to Level 3 on Wednesday night -- meaning citizens should reconsider travel abroad.
The note was released shortly after President Donald Trump’s address to the nation, announcing new travel restrictions from Europe.
Stanford University, in California's Santa Clara County, has confirmed two new cases of the coronavirus – one from Stanford Medicine and another case from the main campus.
A faculty member of Stanford Medicine was also confirmed with a case of coronavirus last week, bringing the university's total to three cases, Stanford said in a letter to its community.
Stanford and health officials are now working to conduct contact tracing on the patients.
The letter added that the university would not provide additional information on the patients to protect their privacy.
Stanford is holding online classes: The university canceled all in-person classes for the final two weeks of its winter quarter, and will continue with online classes during the spring quarter.
This comes as a wave of universities across the nation enact similar measures.
Harvard University, for instance, gave students five days to move out of their dorms -- sparking panic and anger among some students, who complained of inadequate administration support.
Mainland China reported 15 new coronavirus cases yesterday -- continuing the week-long trend of dramatically falling numbers, according to China's National Health Commission.
Six of those cases were imported from overseas -- meaning they weren't locally transmitted in China.
Hubei province, where the coronavirus pandemic began back in December, reported eight new cases -- the lowest to be reported from Hubei since the outbreak began.
The drop in new daily cases is especially striking given that just a month or two ago, the country was reporting around 2,000 new cases per day.
China has now reported 80,793 cases and 3,169 deaths.
Of the total cases, 62,793 have recovered and been discharged from hospital, according to the NHC.
North Dakota has just announced the state's first case of coronavirus.
The presumptive positive case is a resident in his 60s from Ward County, according to a news release from North Dakota Governor Doug Burgum.
The patient had traveled out of state, and had contact with another infected person, said the news release.
“With the North Dakota Department of Health and its partners at the state, local and federal levels, we are working together to stay on top of this rapidly evolving situation."" The White House has canceled a Thursday reception to celebrate St. Patrick’s Day and the visit of Ireland's Prime Minister Leo Varadkar, an attendee told CNN.
In an email to guests shared with CNN, the White House Social Office wrote, ""Out of an abundance of caution, the White House St. Patrick's Day Reception"" is canceled.
CNN has asked if the rest of the Varadkar's meetings with the President will happen, but have not received a response.
Officials learned a player from Utah Jazz had tested positive coronavirus right before the tip-off of their game with Oklahoma City Thunder on Wednesday, the Jazz said in a statement.
The player's symptoms had ""diminished over the course"" of the day so a test for COVID-19 was performed, the team said.
Because of the positive result, the game was postponed with the NBA later announcing that they were suspending the season.
The Jazz added that they are “working closely with the CDC, Oklahoma and Utah state officials and the NBA to determine how to best move forward as we gather more information.
The individual is currently in the care of health officials in Oklahoma City.
In coordination with the NBA and state officials, we will provide updates at the appropriate time.” Please enable JavaScript for a better experience.",2020-03-10,"['case', 'states', 'state', 'health', 'centers', 'case', 'citizen', 'cruise', 'ship', 'case', 'soil', 'state', 'figure', 'case', 'test', 'health', 'lab', 'confirmation', 'death', 'toll', 'state', 'blindside', 'announcement', 'today', 'travel', 'country', 'contact', 'administration', 'day', 'indication', 'length', 'warning', 'administration', 'announcement', 'clarity', 'work', 'measure', 'call', 'state', 'announcement', 'answer', 'question', 'state', 'fact', 'option', 'table', 'state', 'hour', 'address', 'indication', 'announcement', 'tonight', 'source', 'meeting', 'state', 'travel', 'level', 'night', 'citizen', 'reconsider', 'travel', 'release', 'address', 'nation', 'travel', 'restriction', 'university', 'case', 'medicine', 'case', 'campus', 'faculty', 'member', 'medicine', 'case', 'week', 'university', 'case', 'letter', 'community', 'health', 'work', 'conduct', 'contact', 'letter', 'university', 'information', 'privacy', 'class', 'university', 'person', 'class', 'week', 'winter', 'quarter', 'class', 'spring', 'quarter', 'university', 'nation', 'measure', 'university', 'instance', 'student', 'day', 'dorm', 'spark', 'panic', 'anger', 'student', 'administration', 'support', 'mainland', 'report', 'case', 'yesterday', 'week', 'trend', 'number', 'health', 'case', 'transmit', 'report', 'case', 'report', 'case', 'strike', 'month', 'country', 'report', 'case', 'day', 'report', 'case', 'death', 'case', 'hospital', 'state', 'case', 'case', 'resident', 'news', 'release', 'travel', 'state', 'contact', 'person', 'news', 'release', 'health', 'partner', 'state', 'level', 'work', 'situation', 'reception', 'day', 'attendee', 'email', 'share', 'office', 'abundance', 'caution', 'day', 'reception', 'rest', 'meeting', 'response', 'player', 'jazz', 'test', 'game', 'city', 'thunder', 'jazz', 'statement', 'player', 'symptom', 'day', 'test', 'team', 'result', 'game', 'season', 'jazz', 'work', 'state', 'information', 'care', 'health', 'city', 'state', 'update', 'time', 'experience']"
