,ArticleText,PublishDate,CleanedArticleText
0,"Our live coverage of the coronavirus outbreak has ended for today.
A total of 304 people had died from coronavirus in mainland China by the end of Saturday, according to the country's National Health Commission.
So far, there have been no deaths outside the mainland.
The vast majority of the deaths have occurred in the province of Hubei, of which Wuhan is the capital.
Wuhan -- home to 11 million people -- is the epicenter of the outbreak.
The total number of confirmed cases in mainland China is now 14,380 -- an increase of 2,590 from Friday's total.
Forty-five more people have died in China's Hubei province, bringing the total death toll in Hubei to 294, health officials said.
Nearly 2,000 new cases of coronavirus were confirmed Saturday in the province, which is the epicenter of the outbreak.
These updated figures push the total number of confirmed cases in mainland China to more than 13,700.
The eighth confirmed case of the novel coronavirus in Germany is a 33-year-old man hospitalized in the state of Bavaria, health officials said Saturday.
The patient is the seventh employee of a company in the district of Starnberg who has been diagnosed, the Bavarian Health Ministry said.
The case was confirmed after all employees at the company were tested in the past three days.
Apple is temporarily closing all of its stores, corporate offices and contact centers in mainland China until February 9, the company told CNN.
The decision was taken ""out of an abundance of caution and based on the latest advice from leading health experts,"" Apple said in a statement.
CEO Tim Cook said in an earnings call on Tuesday that the company had been regularly deep cleaning stores and conducted temperature checks on employees to avoid spreading the virus.
Other major businesses have temporarily closed operations in China amid the outbreak, including Starbucks, which has shuttered more than half its locations, and Ikea.
Australia Prime Minister Scott Morrison said the country won't permit entry of  foreign nationals who travel from mainland China, due to the increasing threat from the coronavirus outbreak.
""Our first responsibility is Australians and Australia's national interests, and that means the health of Australians and their well-being and that is what is driving our decisions,"" the Prime Minister said.
The eighth case of coronavirus confirmed in the US is a student at University of Massachusetts Boston, public health officials in Massachusetts said during a call with reporters today.
The man had recently returned from Wuhan, China, the epicenter of the coronavirus outbreak.
The case poses no increased risk to other students on the university’s campus, said Dr. Jennifer Lo, medical director of the Boston Public Health Commission.
She added that the student, a man in his 20s, is currently “doing quite well” and is being quarantined at his home, which is not in a dorm on campus.
He is being monitored by public health nurses who are calling him regularly.
“We won’t release him from isolation until we are satisfied it’s safe to do so,” said Dr. Larry Madoff, medical director of the Massachusetts Department of Public Health’s Bureau of Infectious Disease and Laboratory Sciences.
“He returned to Boston directly from China through Logan Airport.
He returned on the 28th of January, recognized quickly that he was ill and sought medical attention.
He had only been ill for a brief period of time when he arrived,” Madoff said.
“Active screening had not yet begun at Logan at that time.” The patient had a runny nose when he arrived in Boston, health officials said, and has been in isolation since he sought medical care on Jan. 29.
Madoff said he could count the patient’s close contacts “on our fingers,” and contacts are household members and medical personnel who treated the man.
All public health officials on the call emphasized that the overall risk to residents in Massachusetts remains low.
The eighth confirmed US case of the coronavirus is a “member of the UMass Boston community,” the school said in a statement today.
Defense Secretary Mark Esper has approved a request to provide military housing for up to 1,000 people who may need to be quarantined upon arrival in the US from overseas travel due to concerns about possible infection from the coronavirus, the Pentagon said in a statement today.
The Department of Health and Human Services (HHS) asked the Defense Department to provide several facilities capable of housing at least 250 people in individual rooms through Feb. 29, the Pentagon added.",2020-02-01,"['end', 'today', 'people', 'mainland', 'end', 'country', 'health', 'death', 'mainland', 'death', 'capital', 'home', 'people', 'number', 'case', 'mainland', 'increase', 'people', 'death', 'toll', 'health', 'case', 'update', 'figure', 'push', 'number', 'case', 'mainland', 'case', 'man', 'state', 'health', 'employee', 'company', 'district', 'health', 'case', 'employee', 'company', 'test', 'day', 'store', 'office', 'contact', 'mainland', 'company', 'decision', 'abundance', 'caution', 'advice', 'health', 'expert', 'statement', 'call', 'company', 'cleaning', 'store', 'conduct', 'temperature', 'employee', 'virus', 'business', 'operation', 'shutter', 'half', 'location', 'country', 'permit', 'entry', 'travel', 'mainland', 'increase', 'threat', 'responsibility', 'interest', 'health', 'decision', 'case', 'student', 'university', 'health', 'call', 'reporter', 'today', 'man', 'return', 'case', 'increase', 'risk', 'student', 'university', 'campus', 'director', 'health', 'student', 'man', 'home', 'dorm', 'campus', 'health', 'call', 'release', 'isolation', 'director', 'health', 'sciences', 'return', 'return', 'attention', 'period', 'time', 'screening', 'time', 'nose', 'health', 'isolation', 'care', 'contact', 'finger', 'contact', 'household', 'member', 'personnel', 'treat', 'man', 'health', 'call', 'risk', 'resident', 'case', 'member', 'community', 'school', 'statement', 'today', 'defense', 'military', 'housing', 'people', 'arrival', 'travel', 'concern', 'infection', 'statement', 'today', 'health', 'services', 'defense', 'facility', 'housing', 'people', 'room']"
1,"Please click here to read more live updates on the coronavirus outbreak.
Canadian officials have fielded 325 requests for departure assistance from Hubei Province in China due to the coronavirus, Global Affairs Canada said Sunday in a statement.
Canada is attempting to charter a plane to take Canadians from Wuhan, China, back to Canada, the statement said.
Hubei is the epicenter of the outbreak There are currently 543 Canadians in Hubei who have registered with the voluntary Registration of Canadians Abroad service.
There are currently 15,219 Canadians in China (including Hong Kong) who have registered with the voluntary service.
Since registration is voluntary, this number is not a complete picture of Canadians in the region or in China, the statement said.
Only Canadian citizens who have entered China with a Canadian passport will be allowed to board the plane back to Canada, Global Affairs Canada said.
Canadian citizens will need to have a valid Canadian passport and a valid Chinese visa to board the plane.
Canadians who appear to have symptoms will not be able to board, according to Global Affairs Canada.
The death toll globally is 362.
All but one of those deaths have occurred in mainland China.
Doctors in Thailand say they have successfully treated one Wuhan coronavirus patient with a combination of antiviral drugs, according to a briefing on Sunday from the Ministry of Health.
Dr.Kriangsak Atipornwanich, a doctor at Rajavithi Hospital in Bangkok, said he treated a 71-year-old female patient from China with a combination of drugs used in HIV and flu treatments.
He said the patient had previously been treated with only anti-HIV drugs.
“I had treated a patient with severe condition, and the result has been very satisfactory.
The patient’s condition has improved very quickly within 48 hours.
And the test result has also changed from being positive into negative within 48 hours as well,” Atipornwanich said.
Officials at the press conference said the latest lab test has showed there’s no trace of the virus in the patient’s respiratory system.
Dr. Anthony Fauci, director of the National Institute of Allergy and Infectious Diseases at the US National Institutes of Health, told CNN last week there are currently no proven effective drugs to treat the virus.
Hospitals in Beijing have reported using the same drugs given to HIV and AIDs patients are part of treatment for the Wuhan coronavirus, though it is unclear if they have been successful.
The Hubei health authority reported that 56 people died of the coronavirus on Sunday, raising the death toll since the beginning of the outbreak to 361.
Authorities confirmed an additional 2,103 cases of the virus in Hubei, according to the health authority, which brings the total number of cases to over 16,600.
The health authority said 9,618 patients have been hospitalized, including 478 who are in critical condition.
Russia is suspending all international rail services between Russia and China, including those operated by Chinese rail companies, Russian Railways said Sunday.
Unused tickets for cancelled trains booked and issued at Russian points of sale can be returned without incurring any charges or fees, the company’s statement said.
There are now nine cases of the novel coronavirus in the United States.
There are four confirmed cases in California; one case each in Massachusetts, Washington state and Arizona and two in Illinois.
The second case in Illinois is the only instance so far of person-to-person transmission in the United States, state health officials said.
Confirmed cases by state: Nine confirmed cases as of Sunday, February 2.
The US Department of Homeland Security added four airports – Dallas, Detroit, Newark and Dulles – to the list of airports where US citizens who have traveled to China in the last 14 days can enter the US, according to a statement from the agency.
The restrictions began at 5 p.m. ET Sunday night.
Citizens who have been in Hubei province in the last 14 days of their return will face 14 days of mandatory quarantine.
Those who have been to other parts of China will have 14 days of self-quarantine.
Foreign nationals will be largely denied entry to the US unless they are the immediate family members of US citizens, permanent residents or flight crew.
Santa Clara County, California, confirmed the second case of the novel coronavirus, the Santa Clara County public health department said Sunday.
This second case of the virus is in an adult female, the public health department said in a statement.
The newest case is unrelated to the first case but both individuals recently traveled to Wuhan, China, the department said.
The newest patient arrived January 23 to visit family in Santa Clara County, public health officials said.
She has been regularly monitored and was never sick enough to be hospitalized,"" the statement said.
There have been four cases of the coronavirus in California.",2020-02-02,"['update', 'field', 'departure', 'assistance', 'affairs', 'statement', 'plane', 'statement', 'registration', 'service', 'service', 'registration', 'number', 'picture', 'region', 'statement', 'citizen', 'passport', 'board', 'plane', 'affairs', 'citizen', 'passport', 'board', 'plane', 'symptom', 'board', 'affairs', 'death', 'toll', 'death', 'mainland', 'doctor', 'treat', 'combination', 'drug', 'briefing', 'health', 'doctor', 'hospital', 'treat', 'combination', 'drug', 'use', 'flu', 'treatment', 'treat', 'drug', 'treat', 'condition', 'result', 'condition', 'hour', 'test', 'result', 'change', 'hour', 'press', 'conference', 'lab', 'test', 'virus', 'system', 'director', 'health', 'week', 'drug', 'treat', 'virus', 'hospital', 'report', 'use', 'drug', 'part', 'treatment', 'health', 'report', 'people', 'death', 'toll', 'case', 'virus', 'health', 'number', 'case', 'health', 'condition', 'rail', 'service', 'rail', 'company', 'railways', 'ticket', 'train', 'book', 'issue', 'point', 'sale', 'return', 'charge', 'company', 'statement', 'case', 'states', 'case', 'case', 'state', 'case', 'instance', 'person', 'person', 'transmission', 'states', 'state', 'health', 'case', 'state', 'case', 'security', 'list', 'citizen', 'travel', 'day', 'statement', 'restriction', 'night', 'citizen', 'day', 'return', 'face', 'day', 'part', 'day', 'self', 'entry', 'family', 'member', 'citizen', 'resident', 'flight', 'crew', 'case', 'health', 'case', 'virus', 'adult', 'health', 'statement', 'case', 'case', 'travel', 'family', 'health', 'statement', 'case']"
2,"Our live coverage of the Wuhan coronavirus outbreak has moved here.
Providence Regional Medical Center in Everett, Washington, the hospital said Monday in a statement.
“The patient remains in isolation at home and is being monitored by the Snohomish Health District, in coordination with his care team at Providence,” the statement said.
“For the privacy of the patient, we will not be disclosing the exact date of discharge or any additional details regarding his discharge process.” The patient issued the following statement: “I am at home and continuing to get better.
I ask that the media please respect my privacy and my desire not to be in the public eye.
""I would like to thank the doctors, nurses, and entire team at Providence who cared for me.
I appreciate all of the concern expressed by members of the public, and I look forward to returning to my normal life,"" the patient said.
There are now at least 11 confirmed cases of the novel coronavirus in the United States.
Six cases have been confirmed in California, one in Massachusetts, one in Washington state, one in Arizona and two in Illinois.
The Hubei health authority said 64 more people died of the coronavirus in China's Hubei province on Monday, raising the death toll in the epicenter of the outbreak to 414 people.
In mainland China, 425 people have died from the virus.
The official global death toll is now 426.
Authorities confirmed an additional 2,345 cases of the virus in Hubei on Monday.
That brings the total number of cases in the province to 13,522.
The health authority said 10,990 patients have been hospitalized in Hubei, including 576 who are in critical condition.
There have been more than 19,000 confirmed coronavirus cases globally.
Two patients -- husband and wife -- have been transferred from their home in San Benito County, California, to an undisclosed hospital in San Francisco, Rachel Kagan of SF Department of Public Health told CNN.
The husband had recently traveled to Wuhan, China.
The wife did not, meaning she contracted the virus from person-to-person contact.
“It was then determined that both patients needed to be admitted to a hospital equipped for a higher level of care.
The patients have been transferred out of San Benito County by specialty ambulance,” said Dr. Martin Fenstersheib, San Benito County's public health officer.
The hospital is taking all appropriate precautions for patient and staff safety, said a release from SF Public Health.
It added that there is no elevated risk to the public.
A new case of the virus has been identified in the German federal state of Bavaria, bringing the total number of cases within Germany to 11, Bavaria's Health Ministry confirmed Monday.
According to the State Office for Health and Food Safety, the eleventh case was identified in a child from the district of Traunstein, who tested positive just a week after the child's father was found to have been infected.
On Saturday, CNN reported that the father -- aged 33 -- is an employee at a company in the district of Starnberg, where six other employees previously tested positive with the deadly virus.
Visitors only momentarily drop their masks at the entrances to the casino, to pose for thermal cameras on the lookout for the deadly Wuhan coronavirus that has killed hundreds of people in mainland China and infected thousands more.
The outbreak has left the free-wheeling, semi-autonomous Chinese territory of Macao shell-shocked.
Last year the city received almost 40 million visitors.
Now, streets and squares once teeming with tourists from mainland China are empty.
Ambulances roam the city, operated by emergency workers dressed in hazardous materials suits.
Much is still unknown about the Wuhan coronavirus outbreak, and health officials are urging vigilance.
That means travelers crisscrossing the globe should be aware of the virus, steer clear of heavily impacted areas and exercise some of the same kinds of preventive measures they'd use to avoid influenza and other illnesses.
Many countries are issuing travel advisories and airlines all over the globe are canceling flights to China.
Employees of many companies that have suspended operations in China should be receiving their paychecks as usual.
Following the extension of the Lunar New Year holiday because of the outbreak of coronavirus, China’s government has reinforced labor laws that require employees to be compensated while on vacation.
Local governments have also formulated their own announcements based on the law, according to Matthew Margulies, vice president of China operations at the US-China Business Council.
Employees who have been infected by the virus will still receive compensation, added Margulies.
Additionally, employees that were required to work over the extended holiday will be paid extra.
Initially set to run to January 30, the Chinese government extended the holiday nationwide to February 2.
While business has now resumed in certain areas like Beijing, others like Shanghai and Hubei province are still in lockdown for at least another week.
Starbucks and McDonald’s have closed all their Hubei stores indefinitely while Honda and Renault have extended the shutdown period in their Wuhan plants until February 13.
Other large companies, such as Peugeot and Toyota, have halted operations at their Chinese plants.
Webasto, an auto part company which confirmed last week that four of its employees based at its headquarters near Munich were affected by the virus, has closed its operation in Wuhan until February 14.
A spokesperson for the German company confirmed that workers would be fully paid during the closure.
Over the weekend, two special Air India aircrafts brought home more than 650 Indian passengers from Wuhan.
One returnee told CNN that he was worried about being placed in close quarters with others on the flights: ""There are around 20 of us in a room which is a bit scary,"" said Mohahammad Haseeb, a PhD student at Wuhan University’s Economics department.
""We sit together for our meals,"" he added, saying they will be quarantined until February 15, when test results come back.",2020-02-03,"['hospital', 'statement', 'isolation', 'home', 'health', 'district', 'care', 'team', 'statement', 'privacy', 'date', 'detail', 'regard', 'process', 'issue', 'statement', 'home', 'respect', 'privacy', 'desire', 'eye', 'doctor', 'team', 'care', 'concern', 'member', 'return', 'life', 'case', 'states', 'case', 'state', 'health', 'people', 'death', 'toll', 'people', 'mainland', 'people', 'virus', 'death', 'toll', 'case', 'virus', 'number', 'case', 'health', 'condition', 'case', 'husband', 'wife', 'transfer', 'home', 'hospital', 'health', 'husband', 'travel', 'wife', 'contract', 'virus', 'person', 'person', 'contact', 'hospital', 'level', 'care', 'transfer', 'specialty', 'ambulance', 'health', 'officer', 'hospital', 'precaution', 'staff', 'safety', 'release', 'health', 'risk', 'case', 'virus', 'state', 'number', 'case', 'health', 'state', 'office', 'health', 'food', 'safety', 'case', 'child', 'district', 'test', 'week', 'child', 'report', 'employee', 'company', 'district', 'employee', 'test', 'virus', 'entrance', 'casino', 'camera', 'people', 'mainland', 'territory', 'shock', 'year', 'city', 'street', 'tourist', 'mainland', 'ambulance', 'city', 'emergency', 'worker', 'material', 'suit', 'health', 'vigilance', 'traveler', 'virus', 'impact', 'area', 'exercise', 'measure', 'use', 'country', 'issue', 'travel', 'flight', 'employee', 'company', 'operation', 'extension', 'year', 'holiday', 'government', 'labor', 'law', 'employee', 'compensate', 'vacation', 'government', 'announcement', 'law', 'margulies', 'operation', 'business', 'employee', 'virus', 'compensation', 'margulies', 'employee', 'work', 'holiday', 'set', 'government', 'holiday', 'business', 'resume', 'area', 'lockdown', 'week', 'store', 'period', 'plant', 'company', 'halt', 'operation', 'plant', 'auto', 'part', 'company', 'week', 'employee', 'headquarters', 'virus', 'operation', 'company', 'worker', 'closure', 'weekend', 'air', 'aircraft', 'home', 'passenger', 'place', 'quarter', 'flight', 'room', 'bit', 'student', 'university', 'meal', 'test', 'result']"
