,ArticleText,PublishDate,CleanedArticleText
18,"Our live coverage of the coronavirus outbreak has moved here.
More than 2,100 people have died from coronavirus across the globe, according to the latest figures released Wednesday.
The Hubei health authority reported that 108 more people died of the coronavirus in Hubei province on Wednesday, raising the death toll in the epicenter since the beginning of the coronavirus outbreak to 2,029.
The Hubei report brings the total number of deaths in mainland China to at least 2,112.
The global death toll from coronavirus has risen to at least 2,120, with eight deaths reported outside of mainland China.
Hong Kong and Iran have each reported two deaths from coronavirus.
Taiwan, Japan, the Philippines and France have each reported one death.
The global number of confirmed coronavirus cases now exceeds 76,262, with the vast majority of cases in mainland China.
China’s National Health Commission is expected to release numbers for all of China’s provinces later.
People with the novel coronavirus may have the same viral load — or amount of virus in the body — whether or not they are showing symptoms of illness, according to researchers in China.
The letter from the researchers, which was published in The New England Journal of Medicine, details how the researchers monitored viral loads of the novel coronavirus in samples taken from the nose and throat of 18 patients: nine men and nine women ranging in age from 26 to 76 in Zhuhai, in China’s Guangdong province.
For those samples, a total of 72 nasal swabs and 72 throat swabs were collected and analyzed.
The analysis revealed that higher viral loads were detected soon after a person was showing symptoms, with higher viral loads found in the nose than in the throat.
Yet overall, “the viral load that was detected in the asymptomatic patient was similar to that in the symptomatic patients, which suggests the transmission potential of asymptomatic or minimally symptomatic patients,” the researchers wrote in the letter.
It also turned out that, when it comes to viral shedding, the novel coronavirus seemed to resemble influenza more than SARS, according to the letter.
How many affected: Globally, the World Health Organization has reported that there have been more than 75,000 laboratory or clinically confirmed cases of novel coronavirus and more than 2,000 deaths.
Since mid-January, the US Centers for Disease Control and Prevention has been employing temperature checks at selected airports, at first on people flying in from Wuhan, China, the epicenter of the coronavirus outbreak, and now on all passengers who've been anywhere in mainland China in the past 14 days.
While the CDC has screened more than 30,000 passengers in the past month, not a single US coronavirus case has been caught by airport temperature checks, according to a CNN investigation.
CNN reviewed statements by local, state and federal health officials, and emailed and spoke with officials, to determine how many people eventually diagnosed with the novel coronavirus went through airport temperature checks.
By the numbers: Ten passengers flew into US airports on commercial airliners and were later diagnosed with coronavirus.
Four of those 10 passengers went through temperature checks and were found not to have a fever or any other symptoms of the virus.
Two of those passengers flew into Los Angeles International Airport and two flew into San Francisco International Airport.
Previously, a CDC spokesperson had told CNN that two of the passengers were symptomatic during flight, but the spokesperson later said they were asymptomatic while flying.
Another four out of the 10 passengers were not screened because they flew into airports that did not have screening at the time.
It's unclear whether the final two passengers went through temperature checks because health officials at the CDC and in Wisconsin and Arizona refused to say when asked by CNN.
How the screening works: The temperature checks are part of an overall screening effort that includes giving passengers cards telling them to watch out for fever, cough and trouble breathing, all symptoms of the novel coronavirus disease, also called COVID-19.
While airport temperature checks haven't caught any coronavirus cases, the information cards have helped catch US cases of the virus at least twice – once in a passenger who flew into San Francisco, and once in a passenger who flew into Los Angeles.
The cruise industry is “focused on protecting the health and safety of passengers and crew” amid the coronavirus outbreak, according to the industry’s largest trade group.
“The enhanced screening measures, the first of which were adopted within hours of the WHO declaring a global health emergency, do appear to be working and have enabled operations to continue as usual in many parts of the world,” said Bari Goin-Blaugrund, senior director of strategic communications of Cruise Lines International Association, or CLIA.
Goin-Blaugrund also said that within the global CLIA fleet of 272 cruise ships, only one has experienced any cases of coronavirus on board.
Passengers aboard that ship, the Diamond Princess in Japan, began disembarking Wednesday after a 14-day quarantine.
A total of 624 cases of the virus are linked to the stricken ship.
Analysts say the coronavirus could take a financial toll on the industry, especially in China.
If operators cancel cruises through March, JP Morgan predicts revenue could fall as much at 15%.
Shares for two of the biggest cruise operators — Royal Caribbean and Carnival — are down more than 16% and 14% this year, respectively.
The Chinese Center for Disease Control and Prevention has calculated a case fatality rate of 2.3% for the novel coronavirus — meaning 2.3% of those known to be infected have died.
And remember: International experts have cautioned that early numbers may not tell the whole story.
Case fatality rates may come down as officials discover milder cases who don't seek medical care.
The president of the company that owns the stricken cruise ship Diamond Princess greeted disembarking passengers in Tokyo on Wednesday, acknowledging that customers had endured a ""challenging"" situation following an outbreak of coronavirus on the vessel.
""This is an unprecedented situation,"" Jan Swartz, President of Princess Cruises, said in an interview with CNN on Wednesday.
The Diamond Princess ship became a floating quarantine zone earlier this month.
Dozens of passengers tested positive for the novel coronavirus, effectively trapping more than 3,000 people, including 428 Americans, on board.
A total of 624 confirmed cases of the coronavirus have been linked to the boat -- the largest outbreak outside of China.
Japan’s government did not allow the roughly 1,000 crew members to be quarantined unless they took ill, instead asking them to work and serve the rest of the passengers throughout the two-week period.
“I think the guests and our crew who came together to help support each other, from 57 different countries and regions around the world really lifted each other's hearts, as did social media play a critical role in that.” ""Our guests shared stories about living in the cabin for 14 days, clearly it was an uncomfortable, challenging situation,"" Swartz added.
Even though the departing passengers have tested negative for the virus and endured the 14-day quarantine, there is mounting evidence from infectious disease experts that they could unknowingly be carrying the virus back into their communities.
On Monday, the United States evacuated more than 300 American passengers who had tested negative for the virus from the Diamond Princess, only to discover that more than a dozen of them were infected.
Canada, Australia and Hong Kong have arranged charter flights to take their citizens home after they leave the ship.
Princess Cruises, which operates a fleet of 20 ships, is the third largest cruise line in the world.
Because of the coronavirus outbreak onboard the Diamond Princess, the company has canceled dozens of sailings, and is moving one of its ships, the Sapphire Princess, from Shanghai to Australia.
Shares in Princess Cruises' parent company Carnival Corporation are down nearly 16% for the year.
Carnival said last week that the hit to global bookings and canceled voyages ""will have a material impact"" on its finances.
Carnival runs its flagship Carnival Cruise Line, the Princess Cruises brand and the Holland America Line, whose fleet includes the Westerdam, a ship that has been linked to one confirmed case of the coronavirus.
The US Centers for Disease Control and Prevention issued a new travel advisory today for Hong Kong due to the coronavirus outbreak.
This is the only coronavirus-related travel advisory the agency has issued outside of mainland China.
The CDC advises travelers to “practice usual precautions,” in accordance with a “Watch - Level 1” notice of three possible levels.These precautions include avoiding contact with sick people and cleaning hands.
The agency also advises people to seek medical advice if they have spent time in Hong Kong during the last two weeks and feel ill with fever or respiratory symptoms.
The agency currently lists mainland China as “Warning - Level 3” and advises travelers to “avoid nonessential travel.” The notice excludes Hong Kong, Macau and Taiwan.
Scientists around the world are slamming and debunking conspiracy theories that the novel coronavirus has its origins not in animals, but in a Chinese laboratory, according to a statement published today in the medical journal The Lancet.
""We stand together to strongly condemn conspiracy theories suggesting that COVID-19 does not have a natural origin,” wrote the 27 authors, citing studies from scientists in multiple countries that have analyzed the virus’ genetic makeup.
These studies ""overwhelmingly conclude that this coronavirus originated in wildlife, as have so many other emerging pathogens.” What this is about: CNN previously reported statements by Sen. Tom Cotton of Arkansas this week on Fox News saying that “this virus did not originate in the Wuhan animal market” and implying that it may have started in a laboratory not far away.
""We don't have evidence that this disease originated there ...
but we at least have to ask the question,” Cotton said.",2020-02-19,"['people', 'figure', 'release', 'health', 'report', 'people', 'death', 'toll', 'report', 'number', 'death', 'mainland', 'death', 'toll', 'death', 'report', 'mainland', 'report', 'death', 'report', 'death', 'number', 'case', 'case', 'mainland', 'health', 'release', 'number', 'people', 'load', 'amount', 'virus', 'body', 'symptom', 'researcher', 'letter', 'researcher', 'medicine', 'detail', 'researcher', 'load', 'nose', 'man', 'woman', 'range', 'age', 'analysis', 'load', 'person', 'symptom', 'load', 'nose', 'load', 'transmission', 'researcher', 'letter', 'letter', 'world', 'health', 'report', 'case', 'death', 'centers', 'temperature', 'people', 'passenger', 'mainland', 'day', 'screen', 'passenger', 'month', 'case', 'temperature', 'investigation', 'statement', 'state', 'health', 'email', 'people', 'temperature', 'number', 'passenger', 'passenger', 'temperature', 'symptom', 'virus', 'passenger', 'passenger', 'flight', 'passenger', 'screen', 'screen', 'time', 'passenger', 'temperature', 'health', 'screening', 'work', 'temperature', 'part', 'screening', 'passenger', 'card', 'cough', 'trouble', 'symptom', 'call', 'temperature', 'case', 'information', 'card', 'help', 'case', 'virus', 'passenger', 'passenger', 'cruise', 'industry', 'health', 'safety', 'passenger', 'crew', 'industry', 'trade', 'group', 'screening', 'measure', 'hour', 'health', 'emergency', 'work', 'operation', 'part', 'world', 'blaugrund', 'director', 'communication', 'cruise', 'lines', 'blaugrund', 'cruise', 'ship', 'experience', 'case', 'board', 'passenger', 'ship', 'case', 'virus', 'ship', 'analyst', 'toll', 'industry', 'operator', 'cruise', 'revenue', 'shares', 'cruise', 'operator', 'year', 'calculate', 'case', 'fatality', 'rate', 'expert', 'caution', 'number', 'story', 'case', 'fatality', 'rate', 'case', 'care', 'company', 'cruise', 'ship', 'passenger', 'customer', 'endure', 'situation', 'situation', 'cruises', 'ship', 'month', 'dozen', 'passenger', 'test', 'trap', 'people', 'board', 'case', 'boat', 'government', 'crew', 'member', 'work', 'rest', 'passenger', 'week', 'period', 'crew', 'help', 'support', 'country', 'region', 'world', 'heart', 'role', 'share', 'story', 'day', 'challenge', 'situation', 'passenger', 'test', 'virus', 'endure', 'evidence', 'expert', 'virus', 'community', 'states', 'passenger', 'test', 'virus', 'dozen', 'flight', 'citizen', 'home', 'ship', 'cruises', 'ship', 'cruise', 'line', 'world', 'company', 'dozen', 'sailing', 'ship', 'shares', 'cruises', 'parent', 'company', 'year', 'week', 'voyage', 'material', 'impact', 'finance', 'cruise', 'line', 'cruise', 'brand', 'line', 'ship', 'case', 'centers', 'issue', 'travel', 'today', 'travel', 'issue', 'mainland', 'traveler', 'practice', 'precaution', 'accordance', 'level', 'notice', 'level', 'precaution', 'contact', 'people', 'hand', 'people', 'advice', 'time', 'week', 'symptom', 'list', 'mainland', 'warning', 'level', 'traveler', 'travel', 'notice', 'scientist', 'world', 'conspiracy', 'theory', 'animal', 'statement', 'today', 'lancet', 'conspiracy', 'theory', 'author', 'study', 'scientist', 'country', 'virus', 'makeup', 'study', 'wildlife', 'report', 'statement', 'week', 'news', 'virus', 'animal', 'market', 'evidence', 'question']"
19,"The Hubei health authority in China reported that 115 more people died of the coronavirus in Hubei province on Thursday, raising the death toll in the epicenter since the beginning of the coronavirus outbreak to 2,144.
Hubei authorities confirmed an additional 411 cases of the virus in Hubei on Thursday.
The total number of cases in the epicenter of the outbreak is now 62,442.
By the numbers: The Hubei report brings the total number of deaths in mainland China to at least 2,233.
The global death toll is at least 2,244, with 11 deaths outside of mainland China.
Japan has reported three deaths from the coronavirus, while Hong Kong and Iran have each reported two deaths from coronavirus.
The global number of confirmed coronavirus cases now exceeds 76,154 with the vast majority of cases in mainland China.
China’s National Health Commission is expected to release numbers for all of China’s provinces later today.
Two passengers evacuated from the Diamond Princess cruise ship in Japan have tested positive for the novel coronavirus in Australia.
Brendan Murphy, chief medical officer for the Australian government, said in a statement that 164 people from the Diamond Princess arrived to the Howard Springs Quarantine Facility on Thursday to begin their 14-day quarantine.
Upon arrival, six passengers were identified to have minor respiratory symptoms and/or fevers.
The six symptomatic passengers were moved into isolation and tested, two of those people have since tested positive for the novel coronavirus.
Murphy said both patients ""remain well"" and are being housed in a special isolation unit at the quarantine facility.
Murphy added that ""the development of positive cases after return to Australia is not unexpected"" since there was continued evidence of spread of infection on board the Diamond Princess.
Murphy reassured other passengers and the crew on the Qantas evacuation flight saying that ""all measures were taken to ensure their protection"" and that ""the small number of passengers on the plane meant passengers could be spread out higher risk passengers were seated in separate sections."" The Department of Health reiterated that the two new cases pose no risk to the Howard Spring community and the surrounding communities around the quarantine facility.
Australia now has 17 confirmed cases of the novel coronavirus.
Kuwait Airways suspended all flights to Iran on Thursday until further notice and advised its citizens not to travel to Qom following the emergence of coronavirus cases in the Islamic Republic of Iran, Kuwait Airways and state news said in a statement.
Kuwaiti Health Ministry said in a statement that it is advising citizens not to travel to the Iranian city of Qom. Those returning from Qom will be put into 14-day quarantine to ensure they do not carry the virus.
The International Air Transport Association (IATA) the total global lost revenue for airlines could be $29.3 billion due to coronavirus.
IATA announced that its initial assessment of the impact of the novel coronavirus 2019 outbreak — also known as COVID-19 — shows a potential 13% full-year loss of passenger demand for carriers in the Asia-Pacific region.
“The sharp downturn in demand as a result of COVID-19 will have a financial impact on airlines — severe for those particularly exposed to the China market,” said Alexandre de Juniac, IATA’s director general and CEO.
The US Centers for Disease Control and Prevention issued a new travel advisory today for Japan due to the coronavirus outbreak — the second coronavirus-related travel advisory the agency has issued outside of mainland China.
The CDC advises travelers to “practice usual precautions,” in accordance with a “Watch - Level 1” notice out of three possible levels.
Yesterday, the agency listed the first travel notice outside of mainland China — for Hong Kong, which also carries the “Level 1” advisory.
The agency also advises people to seek medical advice if they have spent time in Japan during the last two weeks and feel ill with fever or respiratory symptoms.
The agency currently lists mainland China as “Warning - Level 3” and advises travelers to “avoid nonessential travel.” The notice excludes Hong Kong, Macau and Taiwan.
Chinese officials say the government has taken prudent action in the handling of the novel coronavirus.
China's State Council Information Office held a news conference today to lay out this case.
Yu Xiangyang, the deputy secretary general of State Council, said the city of Wuhan was put under travel restrictions and the Lunar New Year holiday was extended after President Xi Jinping instructed a senior adviser to ""supervise efforts to contain the novel coronavirus."" Yu also said the government mobilized resources and imports after finding daily demand was 15,000 protective suits a day when the supply was only 10,000 suits a day.
Yu said there were not enough hospital beds at first but it was not acceptable to turn suspected cases away.
He said the government established an ""accountability mechanism"" to ensure that ""officials and governments at all levels are held accountable in a city and a province"".
In a bid to ensure accountability, Yu said, ""We will exercise maximum penalty to all those not doing their job well while working on prevention and control of the epidemic” and said the government was conducting “undercover investigations in communities.” Yu went on to say all reported missed cases covered in the media have been investigated by Xi’s adviser, Sun Chunlan, and that all patients involved have been treated.
US health experts are part of a World Health Organization team in China investigating the novel coronavirus outbreak, WHO Director-General Tedros Adhanom Ghebreyesus said Thursday during a press briefing.
Tedros said the team on the ground in China includes experts from the US Centers for Disease Control and Prevention and the US National Institutes of Health, as well as experts from Singapore, Korea, Japan, Nigeria, Germany and Russia.
The team includes experts in epidemiology, virology, clinical management, outbreak control and public health, he said.
Team members are working with Chinese counterparts to study transmissibility of the virus and the impact the of measures taken in China, Tedros said.
US health officials have said they made repeated offers, starting in early January, to send health experts to China, and expressed frustration that US experts had not yet been invited in.
A plane carrying Ukrainian citizens and other nationals evacuated from Wuhan, China, arrived today at Kharkiv Airport in eastern Ukraine, the Ukrainian Ministry of Interior said in a statement.
The statement said border guards provided clearance for 94 people arriving on the special flight: 22 crew members and accompanying medical personnel, along with 72 passengers.
The ministry said the passengers included 45 Ukrainian citizens and 27 citizens of other countries, including Argentina, Ecuador, the Dominican Republic, El Salvador, Costa Rica, Montenegro, Panama and Israel.
Video released by the ministry showed border control inspectors carrying out their inspections in full protective gear.
Ukrainian President Volodymyr Zelensky defended the move, describing security measures on the flight as “unprecedented.” Passengers on board the aircraft, he added, were all healthy but would be quarantined and monitored over a period of 14 days at a medical facility belonging to the Ukrainian National Guard in the town of Novi Sanzhary.
In a Facebook post, Zelensky called on citizens to stop “attempts to block routes, block hospitals, not allow Ukrainian citizens into Ukraine."" There are currently no diagnosed cases of coronavirus in Ukraine.",2020-02-20,"['health', 'report', 'people', 'death', 'toll', 'case', 'virus', 'number', 'case', 'number', 'report', 'number', 'death', 'mainland', 'death', 'toll', 'death', 'mainland', 'report', 'death', 'report', 'death', 'number', 'case', 'case', 'mainland', 'health', 'release', 'number', 'today', 'passenger', 'cruise', 'ship', 'test', 'officer', 'government', 'statement', 'people', 'facility', 'arrival', 'passenger', 'symptom', 'passenger', 'isolation', 'test', 'people', 'test', 'isolation', 'unit', 'facility', 'development', 'case', 'return', 'evidence', 'infection', 'board', 'reassure', 'passenger', 'crew', 'evacuation', 'flight', 'measure', 'protection', 'number', 'passenger', 'plane', 'passenger', 'risk', 'passenger', 'seat', 'section', 'health', 'case', 'risk', 'spring', 'community', 'community', 'facility', 'case', 'flight', 'notice', 'citizen', 'travel', 'emergence', 'case', 'state', 'news', 'statement', 'health', 'statement', 'citizen', 'travel', 'city', 'return', 'virus', 'air', 'transport', 'revenue', 'assessment', 'impact', 'year', 'loss', 'passenger', 'demand', 'carrier', 'region', 'demand', 'result', 'impact', 'market', 'director', 'centers', 'issue', 'travel', 'today', 'travel', 'issue', 'mainland', 'traveler', 'practice', 'precaution', 'accordance', 'level', 'notice', 'level', 'yesterday', 'list', 'travel', 'notice', 'mainland', 'level', 'people', 'advice', 'time', 'week', 'symptom', 'list', 'mainland', 'warning', 'level', 'traveler', 'travel', 'notice', 'government', 'action', 'state', 'information', 'office', 'news', 'conference', 'today', 'case', 'state', 'city', 'travel', 'restriction', 'year', 'holiday', 'adviser', 'government', 'resource', 'demand', 'suit', 'day', 'supply', 'suit', 'day', 'hospital', 'bed', 'case', 'government', 'accountability', 'government', 'level', 'city', 'bid', 'accountability', 'exercise', 'penalty', 'job', 'work', 'epidemic', 'government', 'conduct', 'investigation', 'community', 'report', 'case', 'cover', 'adviser', 'treat', 'health', 'expert', 'part', 'world', 'health', 'team', 'director', 'press', 'briefing', 'team', 'ground', 'expert', 'centers', 'health', 'expert', 'team', 'expert', 'epidemiology', 'management', 'health', 'team', 'member', 'work', 'counterpart', 'study', 'transmissibility', 'virus', 'impact', 'measure', 'health', 'offer', 'health', 'expert', 'frustration', 'expert', 'plane', 'citizen', 'today', 'statement', 'statement', 'border', 'clearance', 'people', 'flight', 'crew', 'member', 'personnel', 'passenger', 'passenger', 'citizen', 'citizen', 'country', 'release', 'border', 'inspection', 'security', 'measure', 'flight', 'passenger', 'board', 'aircraft', 'period', 'day', 'facility', 'town', 'call', 'citizen', 'hospital', 'citizen', 'case']"
